id,sample-count,bioproject,secondary-accession,study-abstract,study-name,samples
MGYS00001748,768,PRJEB6358,ERP005883,"Given the global burden of diarrheal diseases, it is important to understand how members of the gut microbiota affect the risk for, the course of, and recovery from disease.  This is true for young children when the gut microbiota is being assembled, as well as for adults.  Recent culture-independent analyses of the fecal microbiota of healthy Bangladeshi infants and children, sampled monthly from birth through the second year of life, have identified a group of age-discriminatory bacterial taxa that together define a normal program of postnatal development (maturation) of the gut microbiota. The acute voluminous diarrhea caused by Vibrio cholerae represents a dramatic example of enteropathogen invasion and gut microbial community disruption.  We have conducted a detailed time-series metagenomic study of the fecal microbiota during the acute diarrheal and recovery phases of cholera in a cohort of Bangladeshi adults living in an area with a very high burden of disease. Recovery is characterized by a pattern of accumulation of bacterial taxa that mirrors the normal pattern of assembly/maturation of the microbiota in healthy Bangladeshi children. To define underlying mechanisms, we created an artificial community of 14 sequenced human gut bacterial species in gnotobiotic mice, composed of taxa that directly correlate with recovery from cholera and that are indicative of normal microbiota maturation in healthy Bangladeshi children. One of these age-discriminatory species, Ruminococcus obeum, exhibited consistent increases in its relative abundance upon V. cholerae infection of the mice. Follow-up mono- and bi-colonization studies established that R. obeum restricts V. cholerae colonization. RNA-Seq of the community's meta-transcriptome, combined with assays of autoinducer-2 (AI-2) production and function, revealed that expression of R. obeum luxS (AI-2 synthase) and AI-2 production increase significantly with V. cholerae invasion, and that R. obeum AI-2 causes quorum-sensing mediated repression of toxin co-regulated pilus, a primary V. cholerae colonization factor. Co-colonization experiments in gnotobiotic mice established that R. obeum AI-2 reduces Vibrio colonization/pathogenicity through a novel pathway that does not depend on the canonical V. cholerae AI-2 sensor, LuxP.","Effects of cholera on the human gut microbiota, and interactions between human gut microbes and Vibrio cholerae.","ERS465237,ERS465238,ERS465239,ERS465240,ERS465241,ERS465242,ERS465243,ERS465244,ERS465245,ERS465246,ERS465247,ERS465248,ERS465249,ERS465250,ERS465251,ERS465252,ERS465253,ERS465254,ERS465255,ERS465256,ERS465257,ERS465258,ERS465259,ERS465260,ERS465261"
MGYS00001537,28,PRJEB19367,ERP021378,Analysis of stool samples from sickle cell disease patients and healthy controls,Analysis of stool samples from sickle cell disease patients and healthy controls,"ERS1546031,ERS1546032,ERS1546033,ERS1546034,ERS1546035,ERS1546036,ERS1546037,ERS1546038,ERS1546039,ERS1546040,ERS1546041,ERS1546042,ERS1546043,ERS1546044,ERS1546045,ERS1546046,ERS1546047,ERS1546048,ERS1546049,ERS1546050,ERS1546051,ERS1546052,ERS1546053,ERS1546054,ERS1546055"
MGYS00001442,15,PRJEB19090,ERP021080,"Gut microbiome research is rapidly moving towards the functional characterization of the microbiota by means of shotgun meta-omics. Here, we selected a cohort of healthy subjects from an indigenous and monitored Sardinian population to analyze their gut microbiota using both shotgun metagenomics and shotgun metaproteomics. We found a considerable divergence between genetic potential and functional activity of the human healthy gut microbiota, in spite of a quite comparable taxonomic structure revealed by the two approaches. Investigation of inter-individual variability of taxonomic features revealed Bacteroides and Akkermansia as remarkably conserved and variable in abundance within the population, respectively. Firmicutes-driven butyrogenesis (mainly due to Faecalibacterium spp.) was shown to be the functional activity with the higher expression rate and the lower inter-individual variability in the study cohort, highlighting the key importance of the biosynthesis of this microbial by-product for the gut homeostasis. The taxon-specific contribution to functional activities and metabolic tasks was also examined, giving insights into the peculiar role of several gut microbiota members in carbohydrate metabolism (including polysaccharide degradation, glycan transport, glycolysis and short-chain fatty acid production). In conclusion, our results provide useful indications regarding the main functions actively exerted by the gut microbiota members of a healthy human cohort, and support metaproteomics as a valuable approach to investigate the functional role of the gut microbiota in health and disease.",Potential and active functions in the gut microbiota of a healthy human cohort,"ERS1509319,ERS1509315,ERS1509321,ERS1509326,ERS1509327,ERS1509320,ERS1509317,ERS1509324,ERS1509328,ERS1509318,ERS1509323,ERS1509316,ERS1509325,ERS1509329,ERS1509322"
MGYS00001280,88,PRJEB13092,ERP014628,"Gastrointestinal disturbances are among the cluster of symptoms commonly reported by individuals diagnosed with ME/CFS (Myalgic Encephalomyelitis/Chronic Fatigue Syndrome), who are also often reported to exhibit altered plasma cytokine profiles. In plasma of ME/CFS patients (n=48) and healthy controls (n=39), we examined a set of inflammatory markers: C-reactive protein (CRP), Intestinal Fatty Acid Binding Protein (I-FABP), lipopolysaccharide (LPS), LPS binding protein (LBP), and soluble CD14 (sCD14).  Levels of LPS, LBP, and sCD14 were elevated in ME/CFS subjects.  Levels of LBP were correlated with LPS and sCD14 and LPS levels correlated with sCD14. We examined the gut microbiota by 16S rRNA sequencing. We observed that bacterial diversity was decreased in the ME/CFS specimens compared to controls, in particular a reduction in the relative abundance and diversity of Firmicutes.  The ME/CFS samples also exhibited an increase in the pro-inflammatory family Enterobacteriaceae and decrease in the anti-inflammatory Ruminococcaceae, including Faecalibacterium, and reduced amounts of beneficial Bifidobacterium species.  Using a machine learning approach, individuals were classified correctly as ME/CFS with an average success rate of 0.8928.  Our results indicate dysbiosis of the gut microbiota in this disease and further suggest an increased incidence of microbial translocation, which may play a role in inflammatory symptoms.",Reduced diversity and altered composition of the gut microbiome in individuals with Myalgic Encephalomyelitis/ChronicFatigue Syndrome,"ERS1091249,ERS1091250,ERS1091251,ERS1091252,ERS1091253,ERS1091254,ERS1091255,ERS1091256,ERS1091257,ERS1091258,ERS1091259,ERS1091260,ERS1091261,ERS1091262,ERS1091263,ERS1091264,ERS1091265,ERS1091266,ERS1091267,ERS1091268,ERS1091269,ERS1091270,ERS1091271,ERS1091272,ERS1091273"
MGYS00001279,158,PRJEB11199,ERP012549,"The aim of this study was to study i) to what extend the microbiota of AN is perturbed in comparison to NW and ii) whether these perturbations are recovered after weight gain and/or normalisation of eating behaviour. In this study we have comprehensively analysed the gut microbiota (by sequencing of the V4 region of the 16S rRNA gene using MiSeq PE250) and short-chain fatty-acids (SCFA) profile in stool samples of AN patients ahead (n=55) and after weight gain (n=44) in comparison to normal-weight participants matched for age and gender (NW, n=55).",Microbiota composition in Anorexia Nervosa patients before and after weight gain as compared to healthy controls,"ERS986888,ERS986889,ERS986890,ERS986891,ERS986892,ERS986893,ERS986894,ERS986895,ERS986896,ERS986897,ERS986898,ERS986899,ERS986900,ERS986901,ERS986902,ERS986903,ERS986904,ERS986905,ERS986906,ERS986907,ERS986908,ERS986909,ERS986910,ERS986911,ERS986912"
MGYS00001252,157,PRJNA306884,SRP067761,"Colonic bacteria produce the health-promoting metabolite butyrate. We sought to influence butyrate production in 20 healthy adults by supplementing their diet with resistant starch (RS). While average fecal butyrate increased from 8 to 12 mmol/kg wet feces, responses varied widely between individuals. Three types of responses were categorized: enhanced, high, and low (n = 11, 3, and 6 respectively). Fecal butyrate increased by 87% in the enhanced group, while it remained =12 mmol/kg in the high group and =8 mmol/kg in the low group. Microbiome analyses revealed that RS-degrading organisms increased from ~ 2 to 10% in the enhanced and high groups, but remained at ~ 2% in the low group. This lack of increase in RS-degrading microbes is likely why individuals in the low group do not benefit in butyrate with RS. This study underscores the importance of understanding inter-individual variability in managing ecosystem services from microbiomes.",Managing human microbiomes: Explaining heterogeneous responses in butyrate to dietary supplementation with resistant starch,"SRS1223284,SRS1223289,SRS1223290,SRS1223291,SRS1223292,SRS1223293,SRS1223294,SRS1223295,SRS1223296,SRS1223297,SRS1223298,SRS1223299,SRS1223300,SRS1223301,SRS1223302,SRS1223303,SRS1223304,SRS1223305,SRS1223306,SRS1223307,SRS1223308,SRS1223309,SRS1223310,SRS1223311,SRS1223312"
MGYS00001175,72,PRJEB8094,ERP009131,"The human gut microbiota is affected by antibiotics, but the heterogeneous response between individuals remains unexplored. To specifically address this question and examine the effect of antibiotics on selection of resistance genes, we administered the second-generation cephalosporin cefprozil to healthy volunteers. Stool samples gathered before antibiotic exposure, at the end of the treatment and three months later were analyzed using shotgun metagenomic sequencing. We show that normal antibiotic treatment can alter the gut microbiome in a specific, reproducible and predictable fashion. Strikingly, we identified a subgroup of participants that were enriched in opportunistic pathogen Enterobacter cloacae after exposure to the antibiotic, an effect linked to lower initial microbiome diversity and to the Bacteroides enterotype. Resistance genes that were not detectable before the treatment were observed after a 7-day course of antibiotic. Knowledge of the initial composition of the microbiome could assist in the prevention of the adverse effects of antibiotics.",The initial state of the human gut microbiome determines its reshaping by antibiotics,"ERS634967,ERS634947,ERS634915,ERS634960,ERS634959,ERS634914,ERS634930,ERS634916,ERS634948,ERS634940,ERS634973,ERS634952,ERS634926,ERS634975,ERS634969,ERS634977,ERS634936,ERS634943,ERS634957,ERS634932,ERS634954,ERS634965,ERS634929,ERS634958,ERS634924"
MGYS00000277,19,PRJNA46321,SRP002423,"Inflammatory bowel diseases (IBD), such as Crohn’s disease, are chronic, immunologically mediated disorders that have severe medical consequences. The current hypothesis is that these diseases are due to an overly aggressive immune response to a subset of commensal enteric bacteria. Studies to date on IBD have suggested that the disorder may be caused by a combination of bacteria and host susceptibility; however the etiologies of these diseases remain an enigma.  In this application, we propose to develop and demonstrate the ability to profile Crohn’s disease at an unprecedented molecular level by elucidation of specific biomarkers (bacterial strains, genes, or proteins) that correlate to disease symptoms. To achieve this goal, we will employ a multidisciplinary approach based on metagenomic and metaproteomic molecular tools to elucidate the composition of the commensal microbiota in monozygotic twins that are either healthy or exhibit Crohn’s disease (for concordant, both are diseased; for discordant, one is healthy and one is diseased).  The central hypotheses of this proposal are (1) that specific members and/or functional activities of the gastrointestinal (GI) microbiota differ in patients with Crohn’s disease as compared to healthy individuals, and (2) that it will be possible to elucidate microbial signatures which correlate with the occurrence and progression of this disease by integration of data obtained from 16S rRNA-based molecular fingerprinting, metagenomics, and metaproteomics approaches. To address these hypotheses, three specific aims are proposed: 1) Obtain data on community gene content (metagenome) in a subset of healthy twins and twins with Crohn’s Disease to assess potential differences in the metabolic capabilities of the gut microbiota associated with CD, 2) Obtain data on community protein content (metaproteome) in a subset of healthy twins and twins with Crohn’s Disease to assess the state of expressed proteins associated with CD, 3) Apply various statistical clustering and classification methods to correlate/associate microbial community composition, gene and protein content with patient metadata, including metabolite profiles and clinical phenotype.  The ultimate goal of these efforts is to identify novel biomarkers for non-invasive diagnostics of CD and to eventually identify drug targets (i.e. bacterial strains) for cure or suppression of disease symptoms.  PUBLIC HEALTH RELEVANCE: This study aims to unravel the contribution of the bacteria that normally inhabit the human gastrointestinal tract to Crohn’s disease by using a multidisciplinary approach to study changes in the structure and function of gut microbial communities in three sets of patient cohorts who have Crohn’s disease. These results will be compared with those obtained from the study of healthy individuals and have the potential to identify new biomarkers of disease severity, location, and progression.",Human Gut Microbiome in Crohn's Disease,"SRS070510,SRS070511,SRS070519,SRS070520,SRS070521,SRS070522,SRS070523,SRS070524,SRS070525,SRS070526,SRS070527,SRS070528,SRS070529,SRS070530,SRS070532,SRS070533,SRS070534,SRS070535,SRS070536"
MGYS00000278,17,,SRP002437,"The colonization process of the infant gut microbiome has been called chaotic, but this view could reflect insufficient documentation of the factors affecting the microbiome. We performed a 2.5-year case study of the assembly of the human infant gut microbiome to relate life events to microbiome composition and function. Sixty fecal samples were collected from a healthy infant along with a diary of diet and health status. Analysis of >300,000 16S rRNA genes indicated that the phylogenetic diversity of the microbiome increased gradually over time and that changes in community composition conformed to a smooth temporal gradient. In contrast, major taxonomic groups showed abrupt shifts in abundance corresponding to changes in diet or health. Community assembly was nonrandom: we observed discrete steps of bacterial succession punctuated by life events. Furthermore, analysis of ~500,000 DNA metagenomic reads from 12 fecal samples revealed that the earliest microbiome was enriched in genes facilitating lactate utilization, and that functional genes involved in plant polysaccharide metabolism were present prior to the introduction of solid food, priming the infant gut for an adult diet. However, ingestion of table foods caused a sustained increase in the abundance of Bacteroidetes, elevated fecal short chain fatty acid levels, enrichment of genes associated with carbohydrate utilization, vitamin biosynthesis and xenobiotic degradation, and a more stable community composition, all of which are characteristic of the adult microbiome. This study revealed that seemingly chaotic shifts in the microbiome could be attributed to life events.",Developing infant gut microbiome,"SRS086433,SRS086434,SRS086435,SRS086436,SRS086437,SRS086439,SRS086441,SRS086442,SRS086443,SRS086444,SRS086438,SRS086440,SRS086445,SRS086446,SRS086447,SRS086448,SRS086449"
MGYS00000294,12,PRJEB2778,ERP001038,"Ongoing efforts are directed at understanding the mutualism between the gut microbiota and the host in breast-fed versus formula-fed infants. Due to the lack of tissue biopsies, no investigators have performed a global transcriptional analysis of the developing intestine in healthy infants. As a result, the crosstalk between the microbiome and the host transcriptome in the developing mucosal-commensal environment has not been determined. In this study, we examined the host intestinal mRNA gene expression and microbial DNA profiles in full term 3 month-old infants exclusively formula fed (FF; n=6) or breast fed (BF; n=6) from birth to 3 months. Host mRNA microarray measurements were performed on intact sloughed epithelial cells in stool samples collected at 3 months. Microbial composition from the same stool samples was assessed by metagenomic pyrosequencing. Both host mRNA expression and bacterial microbiome phylogenetic profiles provided strong feature sets that classified the two groups of babies (FF and BF). To determine the relationship between epithelial cell gene expression and the bacterial colony profiles, the host transcriptome and functionally profiled microbiome data were analyzed in a multivariate manner. From a functional perspective, analysis of the gut microbiota's metagenome revealed that virulence characteristics differed between the FF and BF babies. Using canonical correlation analysis, evidence of multivariate structure relating eleven host immunity/mucosal defense-related genes and microbiome virulence characteristics was observed. These results, for the first time, provide insight into the integrated responses of the host and microbiome to dietary substrates in the early neonatal period.In this study, we examined the host intestinal mRNA gene expression and microbial DNA profiles in full term 3 month-old infants exclusively formula fed (FF; n=6) or breast fed (BF; n=6) from birth to 3 months. Host mRNA microarray measurements were performed on intact sloughed epithelial cells in stool samples collected at 3 months. Microbial composition from the same stool samples was assessed by metagenomic pyrosequencing. Both host mRNA expression and bacterial microbiome phylogenetic profiles provided strong feature sets that classified the two groups of babies (FF and BF). To determine the relationship between epithelial cell gene expression and the bacterial colony profiles, the host transcriptome and functionally profiled microbiome data were analyzed in a multivariate manner. From a functional perspective, analysis of the gut microbiota's metagenome revealed that virulence characteristics differed between the FF and BF babies. Using canonical correlation analysis, evidence of multivariate structure relating eleven host immunity/mucosal defense-related genes and microbiome virulence characteristics was observed. These results, for the first time, provide insight into the integrated responses of the host and microbiome to dietary substrates in the early neonatal period.",Mutualism between gut microbiota and the host as revealed in a comparative study of breast-fed versus formula-fed infants,"ERS075404,ERS075405,ERS075406,ERS075407,ERS075408,ERS075409,ERS075410,ERS075411,ERS075412,ERS075413,ERS075414,ERS075415"
MGYS00000307,38,PRJEB3206,ERP001706,"Healthy adult controls and patients affected by ileocolic Crohn’s disease from Valencia (Spain) were examined for their viral and microbial communities from feces and, in one additional case, present in the intestinal tissue. The taxonomical and functional analyses on unassembled and assembled sequence reads, following two different approaches allows as to compare the viral and microbial communities between both groups in study in several ways. For example we compared by group (controls vs patients), by entity (viruses vs bacteria), by reads assembly (assembled vs unassembled reads) and by methodology (our approach vs an existing pipeline). ",Crohn's Disease viral and microbial metagenome,"ERS161373,ERS161374,ERS161375,ERS161376,ERS161377,ERS161378,ERS161379,ERS161380,ERS161381,ERS161382,ERS161383,ERS161384,ERS161385,ERS161386,ERS161387,ERS161388,ERS161389,ERS161390,ERS161391,ERS161392,ERS161393,ERS161394,ERS161395,ERS161396,ERS161397"
MGYS00000308,32,PRJEB3227,ERP001739,"Irritable bowel syndrome (IBS) is the most common functional gastrointestinal disorder in western countries. The definition and treatment of IBS is challenging due to its largely unknown aetiology and the variety of symptoms it can present. Previous studies on IBS suggest subtle alterations in the composition of intestinal microbiota. However, no consensus has been reached regarding the association between specific bacteria and IBS. To overcome the confusion introduced by inter-subject variability and heterogeneity within IBS that is problematic in cross-sectional studies, we undertook a longitudinal study that allowed us to compare samples from single patients at moments with different type and/or severity of symptoms. We present results for two IBS patients with diarrhoea subtype and the healthy relative of one of them. Faecal samples collected every two days the first week and then weekly over two months were analysed through metagenomic and metatranscriptomic approaches. Overall, we detect a greater instability of faecal microbiota in IBS patients when compared to the control, and even larger instability associated with acute diarrheoa. Bacterial composition and encoded functions were fairly stable throughout. On the contrary, the fraction of active bacteria varied markedly in time. Strong and quick compositional shifts were associated with relapse, although with low reproducibility between and within patients. Similarly, changes in the global pattern of gene expression characterized days of worsening, but we could not identify genes or functions associated with relapse. Our results confirm that the association of microbiota with IBS is rather weak.",Follow-up of faecal microbiota in IBS patients,"ERS167143,ERS167144,ERS167145,ERS167139,ERS167150,ERS167168,ERS167146,ERS167147,ERS167162,ERS167159,ERS167166,ERS167163,ERS167149,ERS167148,ERS167152,ERS167137,ERS167138,ERS167140,ERS167141,ERS167142,ERS167151,ERS167153,ERS167154,ERS167155,ERS167156"
MGYS00000319,1,PRJEB1421,ERP002222,"The human intestinal microbiota is a crucial factor in the pathogenesis of various diseases, such as metabolic syndrome or inflammatory bowel disease (IBD). Yet, knowledge about the role of environmental factors such as smoking (which is known to influence theses aforementioned disease states) on the complex microbial composition is sparse. We aimed to investigate the role of smoking cessation on intestinal microbial composition in 10 healthy smoking subjects undergoing controlled smoking cessation. Methods: During the observational period of 9 weeks repetitive stool samples were collected. Based on abundance of 16S rRNA genes bacterial composition was analysed and compared to 10 control subjects (5 continuing smokers and 5 non-smokers) by means of Terminal Restriction Fragment Length Polymorphism analysis and high-throughput sequencing. Results: Profound shifts in the microbial composition after smoking cessation were observed with an increase of Firmicutes and Actinobacteria and a lower proportion of Bacteroidetes and Proteobacteria on the phylum level. In addition, after smoking cessation there was an increase in microbial diversity Conclusions: These results indicate that smoking is an environmental factor modulating the composition of human gut microbiota. The observed changes after smoking cessation revealed to be similar to the previously reported differences in obese compared to lean humans and mice respectively, suggesting a potential pathogenetic link between weight gain and smoking cessation. In addition they give rise to a potential association of smoking status and the course of IBD.",Shifts in Human Intestinal Microbiota after Smoking Cessation,ERS212677
MGYS00000432,1,PRJEB7899,ERP008885,"The human gut microbiome and its associated mobilome is critical to health and wellbeing. It hosts a complex ecosystem comprising a multitude of bacterial species, which contributes functionality that would otherwise be absent from the host. Transient and commensal bacteria in the gut must withstand many stresses. The influence of mobile genetic elements, such as plasmids, in stress adaptation within the ecosystem is relatively unknown. We found evidence for plasmid mediated osmotolerance as a phenotype amongst the Proteobacteria in healthy faecal slurries. A transconjugant carrying multiple plasmids acquired from healthy faecal slurry demonstrated increased osmotolerance in the presence of metal salts, particularly potassium chloride, which was not evident in the recipient. Sequencing and analysis of the total plasmid DNA demonstrated the presence of plasmid-borne osmotolerance systems (including KdpD and H-NS) which may be linked to the observed phenotype.  This is the first report of a transferable osmotolerance phenotype in gut commensals and may have implications for the transfer of osmotolerance in other niches.",Evidence for salt tolerance in the human gut mobilome and potential mechanisms.,ERS620461
MGYS00000456,2,PRJEB8201,ERP009244,"Cultural traditions, diet, and lifestyles of ethnic groups living in different geographic locations can serve as a source of variability in human gut microbiota. To examine the differences in gut microbiome of geographically distinct populations, we have carried out phylogenetic, functional, and metabolite analyses of the distal gut microbiota of healthy adolescents from United States and Egypt using next generation high-throughput sequencing.",Comparison of distal gut microbiota structure and function in US and Egyptian children,"ERS638279,ERS638280"
