id,sample-count,bioproject,secondary-accession,study-abstract,study-name,samples
MGYS00005147,1955,PRJEB5482,ERP004898,"Therapeutic food interventions have reduced mortality in children with severe acute malnutrition (SAM) but incomplete restoration of healthy growth remains a major problem. The relationships between the type of nutritional intervention, the gut microbiota, and therapeutic responses are unclear. In the current study, bacterial species whose proportional representation define a healthy gut microbiota as it assembles during the first two postnatal years were identified by applying a machine-learning-based approach to 16S rRNA datasets generated from monthly fecal samples obtained from a birth-cohort of children, living in an urban slum of Dhaka, Bangladesh, who exhibited consistently healthy growth. These age-discriminatory bacterial species were incorporated into a model that computes a relative microbiota maturity index and microbiota-for-age Z-score that compare development (defined here as maturation) of a childs fecal microbiota relative to healthy children of similar chronologic age. The model was applied to twins and triplets (to test for associations of these indices with genetic and environmental factors including diarrhea), children with SAM enrolled in a randomized trial of two food interventions, and children with moderate acute malnutrition. Our results indicate that SAM is associated with significant relative microbiota immaturity that is only partially ameliorated following two widely used nutritional interventions. Immaturity is also evident in less severe forms of malnutrition and correlates with anthropometric measurements. Microbiota maturity indices provide a microbial measure of human postnatal development, a way of classifying malnourished states, and a parameter for judging therapeutic efficacy. More prolonged interventions with existing or new therapeutic foods and/or addition of gut microbes may be needed to achieve enduring repair of gut microbiota immaturity in childhood malnutrition and improve clinical outcomes. (Subramanian et al., doi:10.1038/nature13421)",Persistent gut microbiota immaturity in malnourished Bangladeshi children,"ERS440524,ERS440550,ERS439602,ERS439592,ERS439423,ERS439448,ERS439466,ERS439490,ERS440876,ERS440933,ERS440462,ERS441082,ERS440909,ERS440968,ERS440658,ERS441008,ERS440686,ERS441023,ERS440754,ERS441063,ERS440869,ERS439525,ERS439630,ERS439651,ERS439663"
MGYS00005142,4357,PRJEB11697,ERP013105,"Abstract: Immunoglobulin A (IgA) is the major class of antibody secreted by the gut mucosa, where it contributes to barrier function by preventing microbial and food antigens from interacting with host tissues1,2. The lack of metrics for quantifying development of the gut microbiota and mucosal immune system has hindered the ability to dissect the effects of microbial, host and environmental factors on their co-development. Therefore, we subjected fecal samples, collected monthly during the first 3 postnatal years from 40 healthy USA twin pairs, to bacterial 16S rRNA gene sequencing and to fluorescence-activated cell sorting to distinguish IgA-targeted from non-targeted taxa. Applying a machine-learning algorithm (Random Forests), we identified a set of 25 age-discriminatory bacterial taxa whose patterns of representation define a program of microbiota assembly/maturation shared across twin pairs. Remarkably, IgA responses to 30 taxa, including a subset of the age-discriminatory organisms, converge on a pattern shared across twin pairs by the second postnatal year; the observed targeting patterns were not simple reflections of relative abundance or taxonomy. Zygosity, delivery mode, and breast versus formula feeding had small albeit statistically significant effects on targeting. In follow-up studies, young germ-free mice were colonized with fecal microbiota obtained from two twin pairs at 6 and 18 months of age, and fed a sequence of human diets designed to simulate the transition from milk feeding to complementary foods. Distinct age-associated differences in mucosal IgA responses to the transplanted human microbiota were recapitulated in both diet contexts for both twin pairs, suggesting that intrinsic properties of their community members play a dominant role in dictating IgA responses.  This approach can be used to define gut mucosal immune development in health and disease states, and help identify ways to repair or prevent perturbations in this facet of host immunity.",Characterizing postnatal co-development of the gut microbiota and mucosal IgA responses in healthy twin pairs and a gnotobiotic mouse model,"ERS1085710,ERS1085711,ERS1085714,ERS1085719,ERS1086008,ERS1086011,ERS1086012,ERS1086354,ERS1086360,ERS1087370,ERS1087863,ERS1083306,ERS1083397,ERS1083547,ERS1083551,ERS1083556,ERS1083558,ERS1083930,ERS1084054,ERS1084060,ERS1084088,ERS1084100,ERS1084520,ERS1084542,ERS1085614"
MGYS00005130,115,PRJEB30401,ERP112853,"Parkinson's disease is a neurodegenerative disorder characterized by the accumulation of intracellular aggregates of misfolded alpha-synuclein along the cerebral axis. Several studies report the association between intestinal dysbiosis and Parkinson, although a cause-effect relationship yet remains to be established. Herein, the composition of the microbiota in fecal extracts of 64 patients with Parkinson's disease and 51 controls was determined using a next generation sequencing approach. A hypothetical functional profile based on the 16S rRNA profile using a predictive metagenomic tool was also performed. A significant decrease in the abundance of taxa belonging to the phylum Firmicutes, particularly in the Lachnospiraceae family was detected in the patient group. Key members of the Lachnospiraceae family, such as the genus Blautia and some related species, were significantly reduced in patients compared to controls. Moreover, consistent with depletion of short chain fatty acids-producing bacteria, genera and species within the Lachnospiraceae family (Butyrivibrio, Pseudobutyrivibrio, Coprococcus, Roseburia and Roseburia faecis) were also decreased. Interestingly, the relative abundance of Brevibacteriaceae and Lachnospiraceae was positively associated with tremor-dominant phenotype, whereas abundance of Enterobacteriaceae and Escherichia was positively associated with non-TD phenotypes. Finally, the functional prediction of gut metagenome composition in patients, in comparison with those of healthy controls, showed the presence of 81 significantly altered metabolic pathways. In particular, there was a significant increase of most pathways of the amino acids and lipids metabolisms, of other secondary metabolites, and in the metabolism and biodegradation of xenobiotics.",Gut Microbiome Alterations Drive Distinct Metabolic Expression Patterns in a Cohort of Italian Patients with Parkinson's Disease,"ERS2988204,ERS2988205,ERS2988206,ERS2988207,ERS2988208,ERS2988209,ERS2988210,ERS2988211,ERS2988212,ERS2988213,ERS2988214,ERS2988215,ERS2988216,ERS2988217,ERS2988218,ERS2988219,ERS2988220,ERS2988221,ERS2988222,ERS2988223,ERS2988224,ERS2988225,ERS2988226,ERS2988227,ERS2988228"
MGYS00003894,89,PRJNA486437,SRP158183,"The 89 fresh feces samples (including 47 modified Kato-Katz thick smear-positive volunteers and 42 healthy controls from five rural communities) were collected in duplicate, with one for microscopic examination, and another one immediately stored at -80? until DNA extraction. All of the subjects were found no other parasite eggs (such as horkworms, roundworm, whipworm, pinworm, Taenia) by microscope.",feces metagenome,"SRS3678195,SRS3678196,SRS3678197,SRS3678198,SRS3678199,SRS3678200,SRS3678201,SRS3678202,SRS3678203,SRS3678204,SRS3678205,SRS3678206,SRS3678207,SRS3678208,SRS3678209,SRS3678210,SRS3678211,SRS3678212,SRS3678213,SRS3678214,SRS3678215,SRS3678216,SRS3678217,SRS3678218,SRS3678219"
MGYS00001257,271,PRJNA298590,SRP064846,"The objective of the study was to investigate the efficacy of fresh, frozen or lyophilized fecal microbiota transplantation (FMT) via colonoscopy in patients with recurrent C. difficile associated diarrhea (RCDAD). After a course of oral vancomycin we performed FMT in 36 patients with =3 bouts of RCDAD. FMT products from thoroughly screened healthy donors after filtering stools twice were given as single (non-pooled) product either as fresh, frozen (-80C) or lyophilized. Patients submitted fresh stools pre- and on 7, 14 and 30 days post-FMT. Bacterial DNA was extracted and the V4 region of the 16S rRNA gene was amplified by PCR and amplicons were sequenced on the MiSeq (Illumina) platform. The unique aspects of this study are the comparative efficacy in different patients with recurrent CDI of FMT using the same donor providing either fresh or frozen product, or the successful use of lyophilized FMT products.",Homo sapiens fecal microbiome transplant,"SRS1115212,SRS1115213,SRS1115214,SRS1115215,SRS1115216,SRS1115217,SRS1115218,SRS1115219,SRS1115220,SRS1115221,SRS1115222,SRS1115224,SRS1115225,SRS1115226,SRS1115227,SRS1115228,SRS1115229,SRS1115230,SRS1115231,SRS1115232,SRS1115233,SRS1115234,SRS1115235,SRS1115236,SRS1115237"
MGYS00001194,210,PRJNA321051,SRP075039,"The gut microbiome plays an important role in normal immune function and has been implicated in several autoimmune disorders. Here we use high-throughput 16S rRNA sequencing to investigate the gut microbiome in subjects with multiple sclerosis (MS, n=61) and healthy controls (n=43). Alterations in the gut microbiome in MS include increases in the genera Methanobrevibacter and Akkermansia and decreases in Butyricimonas, and correlate with variations in the expression of genes involved in dendritic cell maturation, interferon signaling and NF-kB signaling pathways in circulating T cells and monocytes. Patients on disease-modifying treatment show increased abundances of the genera Prevotella and Sutterella, and decreased Sarcina, compared to untreated patients. MS patients of a second cohort show elevated breath methane compared to controls, consistent with our observation of increased gut Methanobrevibacter in MS in the first cohort. Further study is required to assess whether the observed alterations in the gut microbiome play a role in, or are a consequence of, MS pathogenesis.",Alterations of the human gut microbiome in multiple sclerosis,"SRS1435481,SRS1435483,SRS1435484,SRS1435485,SRS1435486,SRS1435487,SRS1435488,SRS1435489,SRS1435490,SRS1435491,SRS1435492,SRS1435493,SRS1435494,SRS1435495,SRS1435496,SRS1435497,SRS1435498,SRS1435499,SRS1435500,SRS1435501,SRS1435502,SRS1435503,SRS1435504,SRS1435505,SRS1435506"
MGYS00001071,43,PRJNA276631,SRP055567,,"16S rRNA profiling of ""Allergy"" and ""Healthy"" human faecal samples","SRS859025,SRS860032,SRS860033,SRS860034,SRS860035,SRS860036,SRS860037,SRS860039,SRS860040,SRS860041,SRS860042,SRS860049,SRS860055,SRS860056,SRS860057,SRS860058,SRS860059,SRS860061,SRS860062,SRS860063,SRS860064,SRS860456,SRS860457,SRS860458,SRS860459"
MGYS00004728,369,,SRP057027,"Dysbiosis in the human intestines, an alteration in the normal composition of the microbiota, characterizes a wide spectrum of diseases, such as infections, irritable bowel syndrome, Crohn's disease. Dysbiosis has been studied extensively but typically characterized cross-sectionally and as alterations in bacterial taxonomic proportions.  The longitudinal contributions of diet, antibiotic use, and inflammation on the evolution of dysbiosis during therapy for Crohn's disease have not been well characterized. Here we used shot-gun metagenomic sequencing of fecal samples collected from a longitudinal prospective cohort of pediatric Crohn's disease subjects to analyze the representation and gene content of all types of organisms present, including bacteria, fungi, archaea and viruses.  Patients initiated treated with either antibodies directed against tumor necrosis factor alpha or enteral nutrition per the treating physician.  Multivariate analysis showed that microbiome composition was associated with three environmental stressors--intestinal inflammation, antibiotic use, and diet.  Bacterial gene signatures suggested that communities in Crohn's samples were responding to oxidative stress. Antibiotic use was associated with a more dysbiotic composition of the bacterial microbiota as well as a distinctive increase in fungal organisms and human DNA content. In contrast, the abundance of tailed phage and archaea was similar in feces of children with Crohn's disease and healthy controls.  Composition of the bacterial and fungal communities were highly correlated. Dysbiosis in bacterial and fungal communities was reduced in patients with reduction of intestinal inflammation by either therapy. Diet had an independent and rapid effect on gut microbiota composition within one week of initiation. Evidently dysbiosis characteristic of Crohn's disease results in part from inflammation and antibiotic use, and involves correlated changes in bacterial and eukaryotic community members.  Notably, the three stressors were independently associated with different bacteria and different gene pathways, reflecting concurrent disruption of normal homeostasis by multiple mechanisms. Thus, while dysbiosis in general is common to multiple disease states, the nature of the dysbiosis is unique to the environmental stressor.","Inflammation, Antibiotics, and Diet as Concurrent Environmental Stressors of the Gut Microbiome in Pediatric Crohn's Disease","SRS899913,SRS899914,SRS899915,SRS899916,SRS899917,SRS899918,SRS899919,SRS899920,SRS899921,SRS899922,SRS899923,SRS899924,SRS899925,SRS899926,SRS899927,SRS899928,SRS899929,SRS899930,SRS899931,SRS899932,SRS899933,SRS899934,SRS899935,SRS899936,SRS899937"
MGYS00002480,53,PRJEB24497,ERP106326,"Metformin is a widely used first-line drug for treatment of type 2 diabetes. Despite its advantages metformin has variable therapeutic effects, contraindications, and side effects. Here, for the very first time, we investigate the short term effect of metformin on the composition of healthy human gut microbiota.",Association of metformin administration with gut microbiome dysbiosis in healthy volunteers,"ERS2575623,ERS2575624,ERS2575625,ERS2575626,ERS2575627,ERS2575628,ERS2575629,ERS2575630,ERS2575631,ERS2575632,ERS2575633,ERS2575634,ERS2575635,ERS2575636,ERS2575637,ERS2575638,ERS2575639,ERS2575640,ERS2575641,ERS2575642,ERS2575643,ERS2575644,ERS2575645,ERS2575646,ERS2575647"
MGYS00002207,104,PRJEB24843,ERP106702,"The risk of acquisition of multidrug-resistant Enterobacteriaceae (MRE) and of occurrence of diarrhea is particularly high when travelling to tropical regions, likely owing to suboptimal hygiene living conditions and uncontrolled antibiotic usage. To date, the link between MRE acquisition, traveller's diarrhoea and the microbiota composition in healthy people has not been addressed. Therefore, we analysed the composition of metabolically active microbiota by sequencing the total cDNA from faecal samples before and after the travelling.",The intestinal microbiota predisposes to the occurrence of traveller's diarrhoea and to the carriage of multidrug-resistant Enterobacteriaceae after travelling to tropical regions.,"ERS2181189,ERS2181190,ERS2181191,ERS2181192,ERS2181193,ERS2181194,ERS2181195,ERS2181196,ERS2181197,ERS2181198,ERS2181199,ERS2181200,ERS2181201,ERS2181202,ERS2181203,ERS2181204,ERS2181205,ERS2181206,ERS2181207,ERS2181208,ERS2181209,ERS2181210,ERS2181211,ERS2181212,ERS2181213"
MGYS00002081,110,PRJEB23524,ERP105282,"Fecal microbiota transplantation (FMT) is a treatment for microbiome-associated diseases in which gut microbiota are transferred from a healthy donor to a patient. Although the success of FMT requires donor bacteria to engraft in the patient's gut, the forces governing bacterial engraftment in humans are unknown. Here, we use a vast, ongoing clinical experiment - the treatment of recurrent Clostridium difficile infection with FMT - to uncover the rules of engraftment in humans. First, we built a machine learning model that accurately predicts which bacterial species will engraft in a given host. We then developed a maximum-likelihood strain inference method, Strain Finder, allowing us to infer the genotypes of donor strains and to track them through patients' guts over time. Surprisingly, engraftment could be predicted largely from the abundance and phylogeny of bacteria in the donor and the pre-FMT patient. We also found that donor strains within a species engraft in an all-or-nothing manner and that previously undetected strains frequently colonize the patient after FMT. We validated these findings in another disease context, metabolic syndrome, suggesting that the same principles of engraftment extend to other indications. These findings may guide the design of bacterial therapeutics that target diseases ranging from ulcerative colitis to cancer.",WGS data from FMT trial for the treatment of recurrent Clostridium difficile infection,"ERS2011663,ERS2011631,ERS2011729,ERS2011680,ERS2011643,ERS2011694,ERS2011706,ERS2011692,ERS2011682,ERS2011713,ERS2011636,ERS2011685,ERS2011702,ERS2011633,ERS2011674,ERS2011686,ERS2011733,ERS2011635,ERS2011720,ERS2011730,ERS2011650,ERS2011658,ERS2011722,ERS2011640,ERS2011666"
MGYS00002064,83,PRJEB23489,ERP105247,"Fecal microbiota transplantation (FMT) is a treatment for microbiome-associated diseases in which gut microbiota are transferred from a healthy donor to a patient. Although the success of FMT requires donor bacteria to engraft in the patient's gut, the forces governing bacterial engraftment in humans are unknown. Here, we use a vast, ongoing clinical experiment - the treatment of recurrent Clostridium difficile infection with FMT - to uncover the rules of engraftment in humans. First, we built a machine learning model that accurately predicts which bacterial species will engraft in a given host. We then developed a maximum-likelihood strain inference method, Strain Finder, allowing us to infer the genotypes of donor strains and to track them through patients' guts over time. Surprisingly, engraftment could be predicted largely from the abundance and phylogeny of bacteria in the donor and the pre-FMT patient. We also found that donor strains within a species engraft in an all-or-nothing manner and that previously undetected strains frequently colonize the patient after FMT. We validated these findings in another disease context, metabolic syndrome, suggesting that the same principles of engraftment extend to other indications. These findings may guide the design of bacterial therapeutics that target diseases ranging from ulcerative colitis to cancer.",16S data from FMT trial for the treatment of recurrent Clostridium difficile infection,"ERS2008779,ERS2008780,ERS2008781,ERS2008782,ERS2008783,ERS2008784,ERS2008785,ERS2008786,ERS2008787,ERS2008788,ERS2008789,ERS2008790,ERS2008791,ERS2008792,ERS2008793,ERS2008794,ERS2008795,ERS2008796,ERS2008797,ERS2008798,ERS2008799,ERS2008800,ERS2008801,ERS2008802,ERS2008803"
MGYS00002027,1,PRJEB22505,ERP104186,The Impact of cefprozil on the gut microbiome of healthy individuals Third Party Annotation (TPA) assembly was derived from the primary whole genome shotgun (WGS) data set PRJEB8094. This project includes samples from the following biomes : Human gut.,EMG produced TPA metagenomics assembly of the The initial state of the human gut microbiome determines its reshaping by antibiotics (Impact of cefprozil on the gut microbiome of healthy individuals) data set,ERS634924
MGYS00001991,3,PRJEB23207,ERP104944,"The human intestinal microbiota is a homeostatic ecosystem with a remarkable impact on human health and the disruption of this equilibrium leads to an increased susceptibility to infection by numerous pathogens. In this study, we used shotgun metagenomic sequencing and two different bioinformatics approaches, to investigate possible changes in the composition of the intestinal microbiota in samples from patients with STEC infection compared to healthy and healed controls, collected during an outbreak caused by a STEC O26:H11 infection. Regardless of the bioinformatic procedure used, a good resolution of the taxonomic profiles of the samples was achieved. The faeces collected from the STEC infected patients showed a lower intestinal abundance of the beneficial microorganisms Bifidobacterium and Clostridiales spp. in comparison to controls where those microorganisms predominated. These differences were observed with both bioinformatic approaches used and seemed to be related with the STEC infection although the variation in the relative abundance of the members of the Bifidobacterium genus could have also been associated with the dysbiotic status following the diarrhoea.Finally, the metagenomic sequencing allowed to identify in the STEC positive samples, all the virulence traits present in the genomes of the STEC O26 that caused the outbreak. The results shown represent a first evidence of the changes occurring in the intestinal microbiota of children in the course of STEC infection and indicate that metagenomics may be a promising tool for the culture-independent clinical diagnosis of the infection.",Metagenomic characterization of the human intestinal microbiota in faecal samples from STEC-infected patients,"ERS1984552,ERS1984650,ERS1984672"
MGYS00001809,712,PRJEB21196,ERP023432,"Background: Early life colonization of the intestinal tract is a dynamic process influenced by numerous factors. The impact of probiotic-supplemented infant formula on the composition and function of the infant gut microbiota is not well defined. Objective:To determine the effect of a bifidobacteria-containing formula on the healthy human intestinal microbiome during the first year of life.Design: Double-blinded, randomized and placebo-controlled study with newborn infants assigned to a standard whey-based formula containing a total of 10(8) cfu/g of Bifidobacterium bifidum, B. breve, B. longum, B. longum subsp. infantis (intervention), or to control formula without bifidobacteria (placebo). Breast-fed controls were included. Diversity and composition of fecal microbiota were determined by 16S rRNA gene amplicon sequencing and metabolite profiles were analysed by UHP-LC mass spectrometry over a period of two years. Results: One hundred six infants were randomized to the interventional (n=48) or placebo (n=49) group; 9 infants were solely breast-fed throughout the entire intervention period of 12 months. Infants exposed to bifidobacteria-supplemented formula showed decreased occurrence of Bacteroides and Blautia spp. associated  with changes in lipids and unknown metabolites at month 1. Microbiota and metabolite profiles converged during the intervention period and long-term colonization (24 months) of the supplemented Bifidobacterium strains was not detected. Significant differences in microbiota and metabolites were detected between infants fed by breast or formula (p<0.005) and between infants born by vaginal and caesarean birth (p<0.005). No significant differences were observed between infant feeding groups regarding growth, antibiotic uptake, or other health variables (p>0.05).Conclusions: The supplementation of bifidobacteria to infant diet can modulate the occurrence of specific bacteria and metabolites during early life with no detectable long-term effects.",Randomized controlled trial on the impact of early live intervention with bifidobacteria on the healthy infant fecal microbiota and metabolite profile,"ERS1779219,ERS1779220,ERS1779221,ERS1779222,ERS1779223,ERS1779224,ERS1779225,ERS1779226,ERS1779227,ERS1779228,ERS1779229,ERS1779230,ERS1779231,ERS1779232,ERS1779233,ERS1779234,ERS1779235,ERS1779236,ERS1779237,ERS1779238,ERS1779239,ERS1779240,ERS1779241,ERS1779242,ERS1779243"
