id,sample-count,bioproject,secondary-accession,study-abstract,study-name,samples
MGYS00000580,75,PRJEB11846,ERP013262,Characterization of gut microbiota in Juvenile Idiopathic arthritis and comparison with healthy subjects.,Gut microbiota of Juvenile Idiopathic arthritis,"ERS979639,ERS979640,ERS979647,ERS979656,ERS979658,ERS979659,ERS979661,ERS979666,ERS979669,ERS979670,ERS979673,ERS979674,ERS979675,ERS979677,ERS979682,ERS979689,ERS979694,ERS979699,ERS979704,ERS979707,ERS979636,ERS979637,ERS979641,ERS979644,ERS979646"
MGYS00006226,67,PRJNA774891,SRP343296,"Aim of this project was to investgigate the effect of fiber-rich diets in the human gut microbiome. The participants were asked to visit the study center sober and received the intervention meal or placebo meal. Additionally, a capsule with food coloring was administered. The intake of the dye stains the stool green which helps to associate collected stool samples and food intake. 16S rRNA gene was sequenced at ZIEL Core Facility Microbiome, Technical University Munich, Germany.",Effects of Dietary Fiber Intervention on Gut Microbiota in Healthy People,"SRS10733356,SRS10733357,SRS10733358,SRS10733359,SRS10733360,SRS10733361,SRS10733362,SRS10733363,SRS10733364,SRS10733365,SRS10733366,SRS10733367,SRS10733368,SRS10733369,SRS10733370,SRS10733371,SRS10733372,SRS10733373,SRS10733374,SRS10733375,SRS10733376,SRS10733377,SRS10733378,SRS10733379,SRS10733380"
MGYS00006224,100,PRJEB52848,ERP137596,"in the present study, we examined the effect of bovine lactoferrin, galactoligosacharides and vitamind D on the gut microbiota composition of 25 elderly women. Participants were distributed into two groups receiving either the dietary intervention (n=12) or the placebo treatment (n=13) for a total period of 9 weeks. During the first 3 weeks of the study, the intervention group consumed 1 g/day bLF, followed by 3 weeks of 1 g/day bLF and 2.64g/day active galactooligosaccharides (GOS), and 3 weeks of 1 g/day bLF, 2.64g/day GOS and 20 μg/day of vitamin D. The placebo group received maltodextrin, in matching dosages with the supplements administrated to the intervention group. Fecal bacterial composition was profiled using partial 16S rRNA gene amplicon sequencing and short-chain fatty acids analysis (SCFA) concentrations were determined with high liquid performance chromatography. Finally, the fecal levels of calprotectin, zonulin, and alpha-1-antitrypsin were measured, as markers of gastrointestinal barrier and inflammation.","The effect of nutritional intervention with lactoferrin, galactooligosacharides and vitamin D on the gut microbiota composition of healthy elderly women","ERS11982348,ERS11982347,ERS11982346,ERS11982345,ERS11982344,ERS11982343,ERS11982342,ERS11982341,ERS11982340,ERS11982339,ERS11982338,ERS11982337,ERS11982336,ERS11982335,ERS11982334,ERS11982333,ERS11982332,ERS11982331,ERS11982330,ERS11982329,ERS11982328,ERS11982327,ERS11982326,ERS11982325,ERS11982324"
MGYS00006399,149,PRJNA805069,SRP359154,"Stool samples for microbial 16S amplicon sequencing and clinical data were collected from 75 lung cancer patients (50 of which were treated with checkpoint inhibitors) and 31 age-matched healthy volunteers. We compared using multivariate analyses cancer patients to healthy controls, and within lung cancer we compared patients with DCB to those without DCB.",Gut microbial signature in lung cancer patients highlights specific taxa as predictors for durable clinical benefit,"SRS11951794,SRS11951792,SRS11951785,SRS11951780,SRS11951770,SRS11951768,SRS11951767,SRS11951765,SRS11951764,SRS11951759,SRS11951757,SRS11951752,SRS11951748,SRS11951746,SRS11951747,SRS11951745,SRS11951736,SRS11951737,SRS11951730,SRS11951722,SRS11951720,SRS11951717,SRS11951714,SRS11951712,SRS11951701"
MGYS00006219,50,PRJEB53018,ERP137776,"The healthy Finnish controls were previously recruited as part of a dietary intervention investigating the effects of partly replacing animal proteins with plant proteins on health; the inclusion and exclusion criteria have been described elsewhere (PMID: 34837522). The fecal samples derived from 50 Finnish controls that were age-, sex- and BMI-matched with the Pakistani controls were included in the present study.",Healthy Finnish controls,"ERS12034898,ERS12034899,ERS12034900,ERS12034901,ERS12034902,ERS12034903,ERS12034904,ERS12034905,ERS12034906,ERS12034907,ERS12034908,ERS12034909,ERS12034910,ERS12034911,ERS12034912,ERS12034913,ERS12034914,ERS12034915,ERS12034916,ERS12034917,ERS12034918,ERS12034919,ERS12034920,ERS12034921,ERS12034922"
MGYS00006076,100,PRJEB55607,ERP140519,The DIME study consists of a randomised 2x2 cross-over human intervention where healthy participants (n = 20) are subjected to a diet high in bioactive-rich food for two weeks and a diet low in bioactive-rich food. There is a four-week washout between the two interventions.,The effect of dietary bioactive on gut microbiome diversity (DIME) – a pilot study,"ERS12855857,ERS12855865,ERS12855909,ERS12855885,ERS12855858,ERS12855904,ERS12855869,ERS12855911,ERS12855893,ERS12855867,ERS12855861,ERS12855856,ERS12855870,ERS12855889,ERS12855883,ERS12855873,ERS12855884,ERS12855853,ERS12855877,ERS12855882,ERS12855930,ERS12855864,ERS12855850,ERS12855852,ERS12855918"
MGYS00005176,750,PRJNA390646,SRP109293,The purpose of this study is to determine if supplementing healthy term infants delivered by C-section or vaginal delivery who only consume breastmilk with a probiotic for 21 consecutive days increases levels of bacteria in infants'' stool.,Infant Microbiota and Probiotic Intake Study (IMPRINT),"SRS2291850,SRS2291852,SRS2291518,SRS2291549,SRS2291564,SRS2291589,SRS2291603,SRS2291694,SRS2291701,SRS2291746,SRS2291782,SRS2291788,SRS2288458,SRS2288461,SRS2288503,SRS2288511,SRS2288520,SRS2288524,SRS2288603,SRS2288637,SRS2291645,SRS2288624,SRS2288609,SRS2288588,SRS2288607"
MGYS00005817,69,PRJEB8347,ERP009422,"Background: Metagenomics has become a prominent approach for exploring the role of the gut microbiota in human health. However, the temporal variability of the healthy gut microbiome has not yet been studied in depth using metagenomics and little is known about the effects of different sampling and preservation approaches. We performed metagenomic analysis on fecal samples from seven subjects collected over a period of up to two years to investigate temporal variability and assess preservation-induced variation, specifically, fresh frozen compared to RNALater. We also monitored short-term disturbances caused by antibiotic treatment and bowel cleansing in one subject. Results: We find that the human gut microbiome is temporally stable and highly personalized at both taxonomic and functional levels. Over multiple time-points, samples from the same subject clustered together, even in the context of a large dataset of 888 European and American fecal metagenomes. One exception was observed in an antibiotic intervention case where, more than one year after the treatment, samples did not resemble the pre-treatment state. Clustering was not affected by preservation method. No species differed significantly in abundance, and only 0.36% of gene families were differentially abundant between preservation methods. Conclusions: Technical variability is small compared to the temporal variability of an unperturbed gut microbiome, which in turn is much smaller than the observed between-subject variability. Thus, short-term preservation of fecal samples in RNALater is an appropriate and cost-effective alternative to freezing of fecal samples for metagenomic studies.",Temporal and technical variability of human gut metagenomes,"ERS652568,ERS652544,ERS652537,ERS652554,ERS652565,ERS652532,ERS652546,ERS652555,ERS652590,ERS652557,ERS652550,ERS652566,ERS652567,ERS652574,ERS652534,ERS652559,ERS652551,ERS652571,ERS652535,ERS652542,ERS652543,ERS652561,ERS652547,ERS652523,ERS652587"
MGYS00005793,4,PRJEB43974,ERP127968,"The Third Party Annotation (TPA) assembly was derived from the primary whole genome shotgun (WGS) data set PRJNA510036, and was assembled with metaSPAdes v3.12.0. This project includes samples from the following biomes: root:Host-associated:Human:Digestive system:Large intestine:Fecal.",EMG produced TPA metagenomics assembly of PRJNA510036 data set (Fecal transplant influence on healthy volunteers).,"SRS4142820,SRS4142816,SRS4142819,SRS4142818"
MGYS00005794,3,PRJNA510036,SRP173438,WGS metagenomics sequencing data describing fecal transplant influence on healthy voluntaries.,Fecal transplant influence on healthy volunteers,"SRS4142820,SRS4142816,SRS4142819"
MGYS00005763,13,PRJNA508395,SRP178190,"Long read sequencing assembly of three healthy human gut microbiome samples, with multiple closed bacterial genomes including Prevotella copri.",Nanopore long read assembly of the human gut metagenome,"SRS5167522,SRS4238914,SRS5167521,SRS5167528,SRS5167526,SRS5167518,SRS5167519,SRS4238911,SRS5167527,SRS5167523,SRS5167524,SRS5167525,SRS5167520"
MGYS00005657,15,PRJEB41181,ERP124921,"The Third Party Annotation (TPA) assembly was derived from the primary whole genome shotgun (WGS) data set PRJEB19090, and was assembled with metaSPAdes v3.14.1. This project includes samples from the following biomes: root:Host-associated:Human:Digestive system:Large intestine:Fecal.",EMG produced TPA metagenomics assembly of PRJEB19090 data set (Potential and active functions in the gut microbiota of a healthy human cohort).,"ERS1509319,ERS1509315,ERS1509321,ERS1509326,ERS1509327,ERS1509320,ERS1509317,ERS1509324,ERS1509328,ERS1509318,ERS1509323,ERS1509316,ERS1509325,ERS1509329,ERS1509322"
MGYS00005601,260,PRJEB30615,ERP113090,"Parkinsons disease (PD) is one of the most common neurodegenerative disorders. It has been repeatedly reported that most patients with PD suffer from gastrointestinal dysfunctions and alterations of the autonomous nervous system in the gut wall called the enteric nervous system (ENS). Such alterations and functional gastrointestinal deficits might occur years before the classical clinical symptoms of PD appear. Until now, only little is known about PD-associated changes in gut microbiota composition and their implication in PD development. Due to variance in previously published reports about the differences between community composition in PD and non-PD patients, our intention is to increase knowledge in this field with the use of two next generation sequencing (NGS) methods (Illumina MiSeq and Ion Torrent PGM) on the same set of samples. The V4 and V5 hypervariable region of bacterial 16S rRNA genes was PCR-amplified from stool samples of 39 PD patients and 25 healthy, age-matched control persons, respectively. Illumina- and Ion Torrent- based sequencing yielded divergent as well as congruent results regarding the bacterial microbiota composition of PD and control samples.Bacterial taxa with differences in relative abundance between PD and control samples that were traceable with both sequencing techniques might play a role for supporting PD diagnosis and therapy.",Identification of Intestinal Bacterial Taxa with a Potential Role in Parkinsons Disease using Illumina MiSeq and Ion Torrent Next Generation Sequencing,"ERS3014523,ERS3014583,ERS3014585,ERS3014584,ERS3014336,ERS3014337,ERS3014338,ERS3014341,ERS3014342,ERS3014344,ERS3014345,ERS3014347,ERS3014356,ERS3014357,ERS3014359,ERS3014362,ERS3014364,ERS3014368,ERS3014373,ERS3014376,ERS3014380,ERS3014383,ERS3014388,ERS3014389,ERS3014393"
MGYS00005516,55,PRJEB20800,ERP022986,"Antibiotics have profound impacts on the microbial communities living in the human gut, where bacterial species harbor and exchange antibiotic resistance genes collectively called resistome. Human population surveys have demonstrated that gut microbial resistomes reflect local antibiotics usage patterns, while previous small cohort studies based on single antibiotic exposures have shown varying degrees of antibiotic impact on the gut microbiota and their associated resistome. However, the role of resistomes of particular gut species in their ability to persist in the face of antibiotic treatment has not been systematically studied.Applying shotgun sequencing and quantitative metagenomics, we analyzed the partial eradication and subsequent regrowth of gut microbiota in 12 healthy young men over a 6 month period following a 4-day intervention with three broad-spectrum antibiotics. The gut microbial communities of the study subjects underwent profound compositional changes due to the treatment but slowly recovered to near-baseline compositions. Immediately after the treatment, the gut microbiota featured an increased relative abundance of opportunistic and proinflammatory bacterial species, and a decreased relative abundance of short chain fatty acid producers, while exhibiting an increased functional potential for multidrug efflux pumps and virulence factors. These enrichment trends were weaker after 8 days and mostly cleared out after 42 days. However, 9 common intestinal commensal species found at baseline and associated with short chain fatty production or efficient digestion of polysaccharides remained undetectable in most of the subjects even after 180 days.Carrying genes that confer resistance to the antibiotics used in this multidrug study had specific consequences for the survival and de novo colonization potential of microbial species. While species harboring beta-lactam resistance genes were positively selected during and after the intervention, those harboring glycopeptide or aminoglycoside resistance exhibited increased odds of de novo colonization but decreased odds of survival. Despite a mild long-lasting imprint following exposure to three antibiotics, the gut microbiota of healthy young adults are resilient to a broad-spectrum antibiotic intervention, and their recovery process is modulated by antibiotic resistance gene carriage.",Gut resistome modulates resilience and recovery of gut microbiota after broad-spectrum antibiotic treatment,"ERS1726296,ERS1726297,ERS1726304,ERS1726343,ERS1726331,ERS1726321,ERS1726346,ERS1726318,ERS1726320,ERS1726335,ERS1726314,ERS1726322,ERS1726328,ERS1726341,ERS1726316,ERS1726345,ERS1726326,ERS1726336,ERS1726340,ERS1726306,ERS1726293,ERS1726347,ERS1726302,ERS1726337,ERS1726303"
MGYS00005392,71,PRJEB31446,ERP114010,The Third Party Annotation (TPA) assembly was derived from the primary whole genome shotgun (WGS) data set: PRJEB7772.  This project includes samples from the following biomes: root:Host-associated:Human:Digestive system:Large intestine:Fecal.,EMG produced TPA metagenomics assembly of the PRJEB7772 data set (An analysis of the composition of viruses and bacteria in stool samples from IBD patients and healthy controls.).,"ERS698791,ERS698796,ERS698660,ERS698769,ERS698792,ERS698822,ERS698654,ERS698656,ERS698659,ERS698661,ERS698662,ERS698665,ERS698670,ERS698681,ERS698683,ERS698688,ERS698699,ERS698703,ERS698705,ERS698714,ERS698718,ERS698720,ERS698723,ERS698725,ERS698729"
MGYS00005394,9,PRJEB9818,ERP010965,"The bacterial component of the human gut microbiota undergoes a definable program of postnatal development. Evidence is accumulating that this program is disrupted in children with severe acute malnutrition (SAM) and that their persistent gut microbiota immaturity, which is not durably repaired with current ready-to-use therapeutic food (RUTF) interventions, is causally related to disease pathogenesis. To further characterize gut microbial community development in healthy versus malnourished infants/children, we performed a time-series metagenomic study of DNA isolated from virus-like particles (VLPs) recovered from fecal samples collected during the first 30 months of postnatal life from eight pairs of mono- and dizygotic Malawian twins concordant for healthy growth, and 12 twin pairs discordant for SAM (either marasmus or kwashiorkor). Both members of discordant pairs were sampled just prior to, during and after treatment with a peanut-based RUTF. Using Random Forests and a dataset of 17,676 viral contigs assembled from shotgun sequencing reads of VLP DNAs, we identified viruses that distinguish different assembly stages of the gut microbiota in the concordant healthy twin pairs. This normal developmental program was impaired in both members of SAM discordant pairs and not repaired with RUTF. Phage plus viruses belonging to the Anelloviridae and Circoviridae families of single-stranded eukaryotic viruses discriminate  discordant pairs from concordant healthy pairs. These results disclose that apparently healthy co-twins in discordant pairs have viromes indicative of familial risk for SAM and provide a human model for delineating normal versus perturbed postnatal acquisition and retention of the gut microbiotas viral component in populations at risk for malnutrition.",The gut DNA viromes of Malawian twins discordant for severe acute undernutrition,"ERS795707,ERS795708,ERS795728,ERS795772,ERS795773,ERS795794,ERS795891,ERS795731,ERS795819"
MGYS00005350,52,PRJNA321058,SRP075633,"This is an uncontrolled, prospective open-label study of FMT from healthy donors to subjects with active CD. A single FMT was performed via colonoscopy. Stool samples were collected prior to FMT and at two time points, four and eight weeks after FMT. Recipients microbial diversity, mucosal T-cell phenotypes and clinical and inflammatory parameters were measured over 12 weeks, and safety over 26 weeks.",Increased intestinal microbial diversity following fecal microbiota transplant for active Crohn''s disease,"SRS1465262,SRS1465274,SRS1465271,SRS1465258,SRS1465248,SRS1465259,SRS1465257,SRS1465256,SRS1465233,SRS1465235,SRS1465236,SRS1465264,SRS1465246,SRS1465263,SRS1465232,SRS1465273,SRS1465265,SRS1465275,SRS1465229,SRS1465254,SRS1465280,SRS1465276,SRS1465267,SRS1465242,SRS1465253"
MGYS00005341,102,PRJEB15111,ERP016813,"Coronary heart disease (CHD) is top risk factor for health in modern society, causing high mortality rate each year. However, there is no reliable way for early diagnosis and prevention of CHD so far. So study the mechanism of CHD and development of novel biomarkers is urgently needed. In this study, metabolomics and metagenomics technology are applied to discover new biomarkers from plasma and urine of 59 CHD patients and 43 healthy controls and trace their origin. We identify GlcNAc-6-P which has good diagnostic capability and can be used as potential biomarkers for CHD, together with mannitol and 15 plasma cholines. These identified metabolites show significant correlations with clinical biochemical indexes. Meanwhile, GlcNAc-6-P and mannitol are potential metabolites originated from intestinal microbiota. Association analysis on species and function levels between intestinal microbes and metabolites suggest a close correlation between Clostridium sp. HGF2 and GlcNAc-6-P, Clostridium sp. HGF2, Streptococcus sp. M143, Streptococcus sp. M334 and mannitol. These suggest the metabolic abnormality is significant and gut microbiota dysbiosis happens in CHD patients.",Integrated metabolomics and metagenomics analysis of plasma and urine identified microbial metabolites associated with coronary heart disease,"ERS1289738,ERS1289708,ERS1289680,ERS1289710,ERS1289747,ERS1289751,ERS1289735,ERS1289776,ERS1289696,ERS1289742,ERS1289724,ERS1289733,ERS1289695,ERS1289775,ERS1289711,ERS1289700,ERS1289727,ERS1289704,ERS1289725,ERS1289719,ERS1289715,ERS1289678,ERS1289743,ERS1289752,ERS1289722"
MGYS00005339,3,PRJEB12669,ERP014167,"Early colonization of intestinal microflora in the human gut is a complex process. It remains unclear when intestinal microflora colonization occurs and how it proceeds. we recruited 10 healthy pairs of twins, including five monozygotic(MZ) and five dizygotic(DZ) twin pairs,who ranged in age from 0 to 6 years old.We performed shotgun metagenomic sequencing on 20 samples and generated averaged data output of 2G per sample.",Gut microbiota of 10 pairs of Chinese infant twins,"ERS1202828,ERS1202820,ERS1202827"
MGYS00005203,832,PRJEB20022,ERP022127,"Changes in the relative abundances of many intestinal microorganisms, both those that naturally occur in the human gut microbiome and those that are considered pathogens, have been associated with a range of diseases. To more accurately diagnose health conditions, medical practitioners could benefit from a molecular, culture-independent assay for the quantification of these microorganisms in the context of a healthy reference range. Here we present the targeted sequencing of the microbial 16S rRNA gene of clinically relevant gut microorganisms as a method to provide a gut screening test that could assist in the clinical diagnosis of certain health conditions. We evaluated the possibility of detecting 46 clinical prokaryotic targets in the human gut, 28 of which could be identified with high precision and sensitivity by a bioinformatics pipeline that includes sequence analysis and taxonomic annotation. These targets included 20 commensal, 3 beneficial (probiotic), and 5 pathogenic intestinal microbial taxa. Using stool microbiome samples from a cohort of 897 healthy individuals, we established a reference range defining clinically relevant relative levels for each of the 28 targets. Our assay quantifies 28 targets in the context of a healthy reference range and correctly reflected 38/38 verification samples of real and synthetic stool material containing known gut pathogens. Thus, we have established a method to determine microbiome composition with a focus on clinically relevant taxa, which has the potential to contribute to patient diagnosis, treatment, and monitoring.",16S rRNA gene sequencing and healthy reference ranges for 28 clinically relevant microbial taxa from the human gut microbiome,"ERS1603557,ERS1603558,ERS1603559,ERS1603560,ERS1603561,ERS1603562,ERS1603563,ERS1603564,ERS1603565,ERS1603566,ERS1603567,ERS1603568,ERS1603569,ERS1603570,ERS1603571,ERS1603572,ERS1603573,ERS1603574,ERS1603575,ERS1603576,ERS1603577,ERS1603578,ERS1603579,ERS1603580,ERS1603581"
MGYS00005184,1557,PRJEB14839,ERP016515,"Intestinal microbiota is known to be important in health and disease. Its composition is influenced by both environmental and host factors. However, few large-scale studies have evaluated the association between host genetic variation and the composition of microbiota. We recruited a cohort of 1,561 healthy individuals, of whom 270 belong in 123 families, and found that almost one-third of fecal bacterial taxa were heritable. In addition, we identified 58 SNPs associated with the relative abundance of 33 taxa in 1 ,098 discovery subjects. Among these, four loci were replicated in a second cohort of 463 subjects: rs621711 78 (nearest gene UBR3) associated with Rikenellaceae, rs1394174 (CNTN6) associated with Faecalibacterium, rs59846192 (DMRTB1) associated with Lachnospira, and rs28473221 (SALL3) associated with Eubacterium. After correction for multiple testing, six associations of 58 remained significant, one of which replicated. These results identify associations between specific genetic variants and the gut microbiome.",Association of host genome with intestinal microbial composition in a large healthy cohort,"ERS1310145,ERS1310146,ERS1310147,ERS1310148,ERS1310149,ERS1310150,ERS1310151,ERS1310152,ERS1310153,ERS1310154,ERS1310155,ERS1310156,ERS1310157,ERS1310158,ERS1310159,ERS1310160,ERS1310161,ERS1310162,ERS1310163,ERS1310164,ERS1310165,ERS1310166,ERS1310167,ERS1310168,ERS1310169"
MGYS00005159,464,PRJNA290926,SRP062005,Using microbiome-based models to differentiate healthy patients from those with colonic lesions.,Microbiome analysis complements fecal occult blood test for improved detection,"SRS1022872,SRS1022903,SRS1023138,SRS1023217,SRS1023226,SRS1022661,SRS1022659,SRS1022667,SRS1022727,SRS1022722,SRS1022739,SRS1022780,SRS1022796,SRS1022838,SRS1022899,SRS1022892,SRS1022918,SRS1023109,SRS1023101,SRS1023099,SRS1023130,SRS1023211,SRS1023174,SRS1023234,SRS1022705"
MGYS00005247,443,PRJDB4998,DRP003338,Fecal microbiota of Japanese healthy adults. 16s rRNA gene library of V1-V2 hyper variable regions derived from the fecal samples of 516 subjects.,Fecal microbiota of Japanese healthy adults,"DRS035241,DRS035244,DRS035252,DRS035260,DRS035265,DRS035338,DRS035543,DRS035549,DRS035551,DRS035552,DRS035556,DRS035566,DRS035568,DRS035573,DRS035577,DRS035582,DRS035698,DRS035708,DRS035262,DRS035264,DRS035364,DRS035421,DRS035584,DRS035585,DRS035726"
